{
  "$schema": "http://json-schema.org/draft-07/schema#",
  "title": "LongTermMemoryRecord",
  "description": "JSON Schema defining canonical structure for LLM Agent System (LAS) memory records.",
  "type": "object",
  "properties": {
    "id": {
      "type": "string",
      "description": "Unique identifier of the memory record, typically hashed or prefixed."
    },
    "session_id": {
      "type": "string",
      "description": "Identifier of the conversation or project session that generated the memory."
    },
    "created_at": {
      "type": "string",
      "format": "date-time",
      "description": "ISO 8601 formatted UTC timestamp of memory creation."
    },
    "source": {
      "type": "string",
      "description": "The generator or module that authored the memory (e.g. 'memory_limit_hook', 'semantic_extraction')."
    },
    "source_hash": {
      "type": "string",
      "description": "SHA-256 hash of the source data used for deduplication."
    },
    "summary": {
      "type": "string",
      "description": "The human-readable summary, fact description, or user preference."
    },
    "keywords": {
      "type": "array",
      "items": {
        "type": "string"
      },
      "description": "Searchable keywords extracted from the memory content."
    },
    "message_count": {
      "type": "integer",
      "minimum": 0,
      "description": "Number of conversation messages summarized in this memory (0 for semantic/preference/handoff)."
    },
    "payload": {
      "type": "object",
      "description": "Detailed payload containing raw message chunks, structured task graphs, or state metadata."
    },
    "domain": {
      "type": "string",
      "enum": ["episodic", "semantic", "preference", "handoff"],
      "description": "The taxonomy domain of the memory."
    },
    "confidence": {
      "type": "number",
      "minimum": 0.0,
      "maximum": 1.0,
      "description": "Factual reliability/confidence score of the memory record."
    },
    "citations": {
      "type": ["array", "null"],
      "items": {
        "type": "string"
      },
      "description": "Task IDs, URLs, or file path references citing the source of the memory."
    },
    "expires_at": {
      "type": ["string", "null"],
      "format": "date-time",
      "description": "Optional ISO 8601 UTC timestamp of memory expiration."
    },
    "privacy_level": {
      "type": "string",
      "enum": ["session", "project", "user", "deployment"],
      "description": "Privacy scope defining visibility of this memory."
    }
  },
  "required": [
    "id",
    "session_id",
    "created_at",
    "source",
    "source_hash",
    "summary",
    "keywords",
    "message_count",
    "payload",
    "domain",
    "confidence",
    "privacy_level"
  ]
}
