[
  {
    "id": "sem-a1b2c3d4e5f67890",
    "session_id": "session-12345",
    "created_at": "2026-05-20T12:05:00Z",
    "source": "semantic_extraction",
    "source_hash": "a1b2c3d4e5f67890abcdef0123456789",
    "summary": "The SQLiteBackend stores data locally in a schema containing memory_records and memory_fts virtual table with FTS5 enabled.",
    "keywords": [
      "sqlitebackend",
      "memory_records",
      "memory_fts",
      "fts5"
    ],
    "message_count": 0,
    "payload": {
      "knowledge": "The SQLiteBackend stores data locally in a schema containing memory_records and memory_fts virtual table with FTS5 enabled."
    },
    "domain": "semantic",
    "confidence": 1.0,
    "citations": [
      "memory_backends.py"
    ],
    "expires_at": null,
    "privacy_level": "project"
  },
  {
    "id": "pref-8f9e0d1c2b3a4a5b",
    "session_id": "session-12345",
    "created_at": "2026-05-20T12:10:00Z",
    "source": "user_preference",
    "source_hash": "8f9e0d1c2b3a4a5bcdef890123456789",
    "summary": "User prefers using HSL tailored colors and Outfit or Inter typography for visual aesthetics in frontend control panels.",
    "keywords": [
      "hsl",
      "outfit",
      "inter",
      "aesthetics"
    ],
    "message_count": 0,
    "payload": {
      "preference": "User prefers using HSL tailored colors and Outfit or Inter typography for visual aesthetics in frontend control panels."
    },
    "domain": "preference",
    "confidence": 1.0,
    "citations": [],
    "expires_at": null,
    "privacy_level": "user"
  }
]
